film_id,event_id,scene_id,utterance_id,scene_position_pct,speaker,raw_speaker,character_id,canonical_name,text,word_count,utterance_type,addressee,addressee_type,line_number,parenthetical,cue_type,gender,gender_rationale,is_named,is_protagonist,included_in_network,parser_canonical_name
up,463,up_s111,up_s111_u0463,0.6145,GAMMA,GAMMA (O.S.),up_gamma,Gamma,We weren't!,2,spoken,,,4378,,indented,M,,True,False,True,Gamma
up,464,up_s111,up_s111_u0464,0.6145,MUNTZ,MUNTZ,up_muntz,Muntz,Go ahead and moor your airship right next to mine.,10,spoken,,,4382,,indented,M,,True,False,True,Muntz
up,465,up_s111,up_s111_u0465,0.6145,CARL,CARL,up_carl,Carl,"We're not actually going inside the ""Spirit of Adventure"" itself?!",10,spoken,,,4392,,indented,M,,True,True,True,Carl
up,466,up_s111,up_s111_u0466,0.6145,MUNTZ,MUNTZ,up_muntz,Muntz,Oh. Would you like to?,5,spoken,,,4398,,indented,M,,True,False,True,Muntz
up,467,up_s111,up_s111_u0467,0.6145,CARL,CARL,up_carl,Carl,Would I?!?!,2,spoken,,,4402,,indented,M,,True,True,True,Carl
up,468,up_s111,up_s111_u0468,0.6145,CARL,CARL,up_carl,Carl,"Wait up, Mr. Muntz!",4,spoken,,,4408,,indented,M,,True,True,True,Carl
up,469,up_s111,up_s111_u0469,0.6145,CARL,CARL,up_carl,Carl,Jiminy Cricket.,2,spoken,,,4414,,indented,M,,True,True,True,Carl
up,470,up_s111,up_s111_u0470,0.6145,BETA,BETA,up_beta,Beta,Not you.,2,spoken,,,4420,,indented,M,,True,False,True,Beta
up,471,up_s111,up_s111_u0471,0.6145,GAMMA,GAMMA,up_gamma,Gamma,What do we do with Dug?,6,spoken,,,4425,,indented,M,,True,False,True,Gamma
up,472,up_s111,up_s111_u0472,0.6145,ALPHA,ALPHA,up_alpha,Alpha,He has lost the bird. Put him in the Cone of Shame.,12,spoken,,,4429,,indented,M,,True,False,True,Alpha
up,473,up_s112,up_s112_u0473,0.6201,DUG,DUG,up_dug,Dug,I do not like the Cone of Shame.,8,spoken,,,4443,,indented,M,,True,False,True,Dug
up,474,up_s113,up_s113_u0474,0.6257,MUNTZ,MUNTZ,up_muntz,Muntz,"Most of the collection is housed in the world's top museums: New York, Munich, London... `Course I kept the best for myself.",22,spoken,,,4459,,indented,M,,True,False,True,Muntz
up,475,up_s113,up_s113_u0475,0.6257,CARL,CARL,up_carl,Carl,Did you ever! Will you look at that?,8,spoken,,,4469,,indented,M,,True,True,True,Carl
up,476,up_s113,up_s113_u0476,0.6257,MUNTZ,MUNTZ,up_muntz,Muntz,"Oh yes, the Arsinoitherium. Beast charged while I was brushing my teeth. Used my shaving kit to bring him down.",20,spoken,,,4473,,indented,M,,True,False,True,Muntz
up,477,up_s113,up_s113_u0477,0.6257,MUNTZ,MUNTZ,up_muntz,Muntz,"Oh, surprise me. Only way to get it out of Ethiopia at the time was to have it declared as ""dental equipment!""",22,spoken,,,4485,(to Carl),indented,M,,True,False,True,Muntz
up,478,up_s113,up_s113_u0478,0.6257,CARL,CARL,up_carl,Carl,"Oh my gosh, the Giant Somalian Leopard Tortoise!",8,spoken,,,4502,,indented,M,,True,True,True,Carl
up,479,up_s113,up_s113_u0479,0.6257,MUNTZ,MUNTZ,up_muntz,Muntz,"Oh, you recognize it? I'm impressed! That's an interesting story there...",11,spoken,,,4508,,indented,M,,True,False,True,Muntz
up,480,up_s113,up_s113_u0480,0.6257,MUNTZ,MUNTZ,up_muntz,Muntz,"Hm, excellent choice. I found it on safari with Roosevelt.",10,spoken,,,4520,(to Carl),indented,M,,True,False,True,Muntz
up,481,up_s113,up_s113_u0481,0.6257,MUNTZ,MUNTZ,up_muntz,Muntz,"He and I fell into a habit of playing gin rummy in the evenings. And did he cheat? Oh, he was horrible!",22,spoken,,,4534,,indented,M,,True,False,True,Muntz
up,482,up_s113,up_s113_u0482,0.6257,ALPHA,ALPHA,up_alpha,Alpha,"Master, dinner is ready.",4,spoken,,,4546,(high-pitched voice),indented,M,,True,False,True,Alpha
up,483,up_s113,up_s113_u0483,0.6257,MUNTZ,MUNTZ,up_muntz,Muntz,"Oh dear, broken translator. It's that loose wire again. There you go big fella.",14,spoken,,,4552,"(leans down, fixes it)",indented,M,,True,False,True,Muntz
up,484,up_s113,up_s113_u0484,0.6257,ALPHA,ALPHA,up_alpha,Alpha,Thank you Master.,3,spoken,,,4562,(deep scary voice),indented,M,,True,False,True,Alpha
up,485,up_s113,up_s113_u0485,0.6257,RUSSELL,RUSSELL,up_russell,Russell,I liked his other voice.,5,spoken,,,4570,,indented,M,,True,False,True,Russell
up,486,up_s113,up_s113_u0486,0.6257,MUNTZ,MUNTZ,up_muntz,Muntz,"Well, dinner is served! Right this way.",7,spoken,,,4576,,indented,M,,True,False,True,Muntz
up,487,up_s114,up_s114_u0487,0.6313,MUNTZ,MUNTZ,up_muntz,Muntz,"So how are things stateside? Almost tempted to go back a few times, but I have unfinished work here... Please.",20,spoken,,,4589,,indented,M,,True,False,True,Muntz
up,488,up_s114,up_s114_u0488,0.6313,MUNTZ,MUNTZ,up_muntz,Muntz,I hope you're hungry because Epsilon is the finest chef I've ever had.,13,spoken,,,4603,,indented,M,,True,False,True,Muntz
up,489,up_s114,up_s114_u0489,0.6313,MUNTZ,MUNTZ,up_muntz,Muntz,"Oh, Epsilon, you've done it again!",6,spoken,,,4617,,indented,M,,True,False,True,Muntz
up,490,up_s114,up_s114_u0490,0.6313,RUSSELL,RUSSELL,up_russell,Russell,Yes!!,1,spoken,,,4621,,indented,M,,True,False,True,Russell
up,491,up_s114,up_s114_u0491,0.6313,RUSSELL,RUSSELL,up_russell,Russell,Hey!,1,spoken,,,4629,,indented,M,,True,False,True,Russell
up,492,up_s114,up_s114_u0492,0.6313,RUSSELL,RUSSELL,up_russell,Russell,Hey!,1,spoken,,,4637,,indented,M,,True,False,True,Russell
up,493,up_s114,up_s114_u0493,0.6313,CARL,CARL,up_carl,Carl,"Oh my Ellie would have loved all this. You know, it's because of you she had this dream to come down here and live by Paradise Falls.",27,spoken,,,4643,,indented,M,,True,True,True,Carl
up,494,up_s114,up_s114_u0494,0.6313,MUNTZ,MUNTZ,up_muntz,Muntz,I'm honored. And now you've made it!,7,spoken,,,4658,,indented,M,,True,False,True,Muntz
up,495,up_s114,up_s114_u0495,0.6313,CARL,CARL,up_carl,Carl,You're sure we're not a bother? I'd hate to impose.,10,spoken,,,4664,,indented,M,,True,True,True,Carl
up,496,up_s114,up_s114_u0496,0.6313,MUNTZ,MUNTZ,up_muntz,Muntz,No no! It's a pleasure to have,7,spoken,,,4670,,indented,M,,True,False,True,Muntz
up,497,up_s114,up_s114_u0497,0.6313,DOG WALLA,DOG WALLA,up_dog_walla,Dog Walla,Treat?! Treat! I want a treat!,6,spoken,,,4678,,indented,Unknown,,False,False,False,Dog Walla
up,498,up_s114,up_s114_u0498,0.6313,MUNTZ,MUNTZ,up_muntz,Muntz,"No no, quiet! Calm down. Calm down...",7,spoken,,,4682,,indented,M,,True,False,True,Muntz
up,499,up_s114,up_s114_u0499,0.6313,RUSSELL,RUSSELL,up_russell,Russell,Hey!,1,spoken,,,4690,,indented,M,,True,False,True,Russell
up,500,up_s114,up_s114_u0500,0.6313,MUNTZ,MUNTZ,up_muntz,Muntz,"Shouldn't've used that word... Having guests is a delight. More often I get thieves, come to steal what's rightfully mine.",20,spoken,,,4694,(CONT'D),indented,M,,True,False,True,Muntz
up,501,up_s114,up_s114_u0501,0.6313,CARL,CARL,up_carl,Carl,No!,1,spoken,,,4706,,indented,M,,True,True,True,Carl
up,502,up_s114,up_s114_u0502,0.6313,MUNTZ,MUNTZ,up_muntz,Muntz,"They called me a fraud, those... dah! But once I bring back this creature, my name will be cleared.",19,spoken,,,4712,,indented,M,,True,False,True,Muntz
up,503,up_s114,up_s114_u0503,0.6313,MUNTZ,MUNTZ,up_muntz,Muntz,"Beautiful, isn't it? I've spent a lifetime tracking it. Sometimes years go by between sightings... MUNTZ I've tried to smoke it out of that deathly labyrinth where it lives... Can't go in after it. Once in, there's no way out. Lost so many dogs...",44,spoken,,,4728,(MORE),indented,M,,True,False,True,Muntz
up,504,up_s114,up_s114_u0504,0.6313,MUNTZ,MUNTZ,up_muntz,Muntz,"And here they come, these bandits, and think the bird is theirs to take! But they soon find that this mountain is a very dangerous place.",26,spoken,,,4753,,indented,M,,True,False,True,Muntz
up,505,up_s114,up_s114_u0505,0.6313,RUSSELL,RUSSELL,up_russell,Russell,"Hey, that looks like Kevin!",5,spoken,,,4767,,indented,M,,True,False,True,Russell
up,506,up_s114,up_s114_u0506,0.6313,MUNTZ,MUNTZ,up_muntz,Muntz,"""Kevin?"" RUSSELL Yeah! That's my new giant bird pet. I trained it to follow us.",15,spoken,,,4771,,indented,M,,True,False,True,Muntz
up,507,up_s114,up_s114_u0507,0.6313,MUNTZ,MUNTZ,up_muntz,Muntz,Follow you? Impossible. How?,4,spoken,,,4783,,indented,M,,True,False,True,Muntz
up,508,up_s114,up_s114_u0508,0.6313,RUSSELL,RUSSELL,up_russell,Russell,She likes chocolate.,3,spoken,,,4787,,indented,M,,True,False,True,Russell
up,509,up_s114,up_s114_u0509,0.6313,MUNTZ,MUNTZ,up_muntz,Muntz,Chocolate?,1,spoken,,,4793,,indented,M,,True,False,True,Muntz
up,510,up_s114,up_s114_u0510,0.6313,RUSSELL,RUSSELL,up_russell,Russell,"Yeah, I gave her some of my chocolate. She goes ga-ga for it.",13,spoken,,,4797,,indented,M,,True,False,True,Russell
up,511,up_s114,up_s114_u0511,0.6313,CARL,CARL,up_carl,Carl,But it ran off! It's gone now.,7,spoken,,,4805,,indented,M,,True,True,True,Carl
up,512,up_s114,up_s114_u0512,0.6313,MUNTZ,MUNTZ,up_muntz,Muntz,"You know, Carl. These people who pass through here, they all tell pretty good stories. A ""Surveyor"" making a map.",20,spoken,,,4814,,indented,M,,True,False,True,Muntz
up,513,up_s114,up_s114_u0513,0.6313,MUNTZ,MUNTZ,up_muntz,Muntz,"A ""Botanist"" cataloguing plants.",4,spoken,,,4828,,indented,M,,True,False,True,Muntz
up,514,up_s114,up_s114_u0514,0.6313,MUNTZ,MUNTZ,up_muntz,Muntz,An old man taking his house to Paradise Falls.,9,spoken,,,4836,,indented,M,,True,False,True,Muntz
up,515,up_s114,up_s114_u0515,0.6313,MUNTZ,MUNTZ,up_muntz,Muntz,That's the best one yet. I can't wait to hear how it ends.,13,spoken,,,4844,,indented,M,,True,False,True,Muntz
up,516,up_s114,up_s114_u0516,0.6313,CARL,CARL,up_carl,Carl,"Well! It's been a wonderful evening, but we'd better be going.",11,spoken,,,4856,,indented,M,,True,True,True,Carl
up,517,up_s114,up_s114_u0517,0.6313,MUNTZ,MUNTZ,up_muntz,Muntz,"Oh, you're not leaving?",4,spoken,,,4864,,indented,M,,True,False,True,Muntz
up,518,up_s114,up_s114_u0518,0.6313,CARL,CARL,up_carl,Carl,We don't want to take advantage of your hospitality. Come on Russell.,12,spoken,,,4868,,indented,M,,True,True,True,Carl
up,519,up_s114,up_s114_u0519,0.6313,RUSSELL,RUSSELL,up_russell,Russell,But we haven't even had dessert yet.,7,spoken,,,4876,,indented,M,,True,False,True,Russell
up,520,up_s114,up_s114_u0520,0.6313,MUNTZ,MUNTZ,up_muntz,Muntz,"No, the boy's right. You haven't had dessert. Epsilon here makes a delicious Cherries Jubilee.",15,spoken,,,4885,,indented,M,,True,False,True,Muntz
up,521,up_s114,up_s114_u0521,0.6313,MUNTZ,MUNTZ,up_muntz,Muntz,"Oh, you really must stay. I insist! We have so much more to talk about!",15,spoken,,,4897,,indented,M,,True,False,True,Muntz
up,522,up_s114,up_s114_u0522,0.6313,RUSSELL,RUSSELL,up_russell,Russell,Kevin?,1,spoken,,,4907,,indented,M,,True,False,True,Russell
up,523,up_s114,up_s114_u0523,0.6313,MUNTZ,MUNTZ,up_muntz,Muntz,It's here.,2,spoken,,,4915,,indented,M,,True,False,True,Muntz
up,524,up_s114,up_s114_u0524,0.6313,MUNTZ,MUNTZ,up_muntz,Muntz,Get them!,2,spoken,,,4921,(to dogs),indented,M,,True,False,True,Muntz
up,525,up_s115,up_s115_u0525,0.6369,CARL,CARL,up_carl,Carl,Hurry!,1,spoken,,,4931,,indented,M,,True,True,True,Carl
up,526,up_s115,up_s115_u0526,0.6369,RUSSELL,RUSSELL,up_russell,Russell,I am hurrying!,3,spoken,,,4935,,indented,M,,True,False,True,Russell
up,527,up_s115,up_s115_u0527,0.6369,RUSSELL,RUSSELL,up_russell,Russell,They're coming!,2,spoken,,,4941,,indented,M,,True,False,True,Russell
up,528,up_s115,up_s115_u0528,0.6369,DUG,DUG (O.S.),up_dug,Dug,"Master, over here!",3,spoken,,,4949,,indented,M,,True,False,True,Dug
up,529,up_s115,up_s115_u0529,0.6369,DUG,DUG,up_dug,Dug,"Go toward the light, master!",5,spoken,,,4968,,indented,M,,True,False,True,Dug
up,530,up_s115,up_s115_u0530,0.6369,CARL,CARL,up_carl,Carl,Russell!,1,spoken,,,4992,,indented,M,,True,True,True,Carl
up,531,up_s116,up_s116_u0531,0.6425,CARL,CARL,up_carl,Carl,Get back!!,2,spoken,,,5004,,indented,M,,True,True,True,Carl
up,532,up_s116,up_s116_u0532,0.6425,DUG,DUG,up_dug,Dug,Go on Master! I will stop the dogs!,8,spoken,,,5016,,indented,M,,True,False,True,Dug
up,533,up_s116,up_s116_u0533,0.6425,DUG,DUG,up_dug,Dug,Stop you dogs!!,3,spoken,,,5025,,indented,M,,True,False,True,Dug
up,534,up_s116,up_s116_u0534,0.6425,RUSSELL,RUSSELL,up_russell,Russell,Help! Help!,2,spoken,,,5041,,indented,M,,True,False,True,Russell
up,535,up_s116,up_s116_u0535,0.6425,CARL,CARL,up_carl,Carl,Gimme your hand!,3,spoken,,,5047,,indented,M,,True,True,True,Carl
up,536,up_s116,up_s116_u0536,0.6425,RUSSELL,RUSSELL,up_russell,Russell,Hang on to Kevin!,4,spoken,,,5063,,indented,M,,True,False,True,Russell
up,537,up_s116,up_s116_u0537,0.6425,RUSSELL,RUSSELL (O.S.),up_russell,Russell,Kevin!,1,spoken,,,5085,,indented,M,,True,False,True,Russell
up,538,up_s116,up_s116_u0538,0.6425,RUSSELL,RUSSELL,up_russell,Russell,No no no! Kevin! Stay down. She's hurt real bad. Can't we help her get home?,16,spoken,,,5106,(to Carl),indented,M,,True,False,True,Russell
up,539,up_s116,up_s116_u0539,0.6425,CARL,CARL,up_carl,Carl,Alright. But we've got to hurry.,6,spoken,,,5122,,indented,M,,True,True,True,Carl
up,540,up_s117,up_s117_u0540,0.648,MUNTZ,MUNTZ,up_muntz,Muntz,You lost them?,3,spoken,,,5130,,indented,M,,True,False,True,Muntz
up,541,up_s117,up_s117_u0541,0.648,BETA,BETA,up_beta,Beta,"Uh, it was Dug.",4,spoken,,,5134,,indented,M,,True,False,True,Beta
up,542,up_s117,up_s117_u0542,0.648,GAMMA,GAMMA,up_gamma,Gamma,"Yeah, he's with them. He helped them escape!",8,spoken,,,5138,,indented,M,,True,False,True,Gamma
up,543,up_s117,up_s117_u0543,0.648,MUNTZ,MUNTZ,up_muntz,Muntz,Wait. Wait a minute. Dug...,5,spoken,,,5146,,indented,M,,True,False,True,Muntz
up,544,up_s118,up_s118_u0544,0.6536,CARL,CARL,up_carl,Carl,See anything?,2,spoken,,,5165,,indented,M,,True,True,True,Carl
up,545,up_s118,up_s118_u0545,0.6536,DUG,DUG,up_dug,Dug,"No, my pack is not following us! Boy they are dumb.",11,spoken,,,5169,,indented,M,,True,False,True,Dug
up,546,up_s118,up_s118_u0546,0.6536,CARL,CARL,up_carl,Carl,This is crazy. I finally meet my childhood hero and he's trying to kill us! What a joke.,18,spoken,,,5179,,indented,M,,True,True,True,Carl
up,547,up_s118,up_s118_u0547,0.6536,DUG,DUG,up_dug,Dug,"Hey, I know a joke. A squirrel walks up to a tree and says I forgot to store acorns for winter and now I am dead. Ha! It is funny because the squirrel gets dead.",35,spoken,,,5187,,indented,M,,True,False,True,Dug
up,548,up_s118,up_s118_u0548,0.6536,CARL,CARL,up_carl,Carl,Careful Russell.,2,spoken,,,5201,,indented,M,,True,True,True,Carl
up,549,up_s118,up_s118_u0549,0.6536,RUSSELL,RUSSELL,up_russell,Russell,"You okay, Kevin?",3,spoken,,,5209,,indented,M,,True,False,True,Russell
up,550,up_s118,up_s118_u0550,0.6536,RUSSELL,RUSSELL,up_russell,Russell,"You know what, Mr. Fredricksen? The wilderness isn't quite what I expected.",12,spoken,,,5215,,indented,M,,True,False,True,Russell
up,551,up_s118,up_s118_u0551,0.6536,CARL,CARL,up_carl,Carl,Yeah? How so?,3,spoken,,,5223,,indented,M,,True,True,True,Carl
up,552,up_s118,up_s118_u0552,0.6536,RUSSELL,RUSSELL,up_russell,Russell,"It's kinda... wild. I mean, it's not how they made it sound in my book.",15,spoken,,,5227,,indented,M,,True,False,True,Russell
up,553,up_s118,up_s118_u0553,0.6536,CARL,CARL,up_carl,Carl,"Hmm, get used to that, kid.",6,spoken,,,5235,,indented,M,,True,True,True,Carl
up,554,up_s118,up_s118_u0554,0.6536,RUSSELL,RUSSELL,up_russell,Russell,"My dad made it sound so easy. He's really good at camping, and how to make fire from rocks and stuff. He used to come to all my Sweatlodge meetings.",30,spoken,,,5240,,indented,M,,True,False,True,Russell
up,555,up_s118,up_s118_u0555,0.6536,RUSSELL,RUSSELL,up_russell,Russell,"And afterwards we'd go get ice cream at Fentons. I always get chocolate and he gets butter- brickle. Then we'd sit on this one curb, right outside, and I'll count all the blue cars and he counts all the red ones, and whoever gets the most, wins. I like that curb.",51,spoken,,,5254,,indented,M,,True,False,True,Russell
up,556,up_s118,up_s118_u0556,0.6536,RUSSELL,RUSSELL,up_russell,Russell,"That might sound boring, but I think the boring stuff is the stuff I remember the most.",17,spoken,,,5274,,indented,M,,True,False,True,Russell
up,557,up_s118,up_s118_u0557,0.6536,RUSSELL,RUSSELL,up_russell,Russell,"Look, there it is!",4,spoken,,,5286,,indented,M,,True,False,True,Russell
up,558,up_s118,up_s118_u0558,0.6536,CARL,CARL,up_carl,Carl,"Hold on Russell, stand still!",5,spoken,,,5296,,indented,M,,True,True,True,Carl
up,559,up_s118,up_s118_u0559,0.6536,CARL,CARL,up_carl,Carl,Look at that bird go!,5,spoken,,,5310,,indented,M,,True,True,True,Carl
up,560,up_s118,up_s118_u0560,0.6536,CARL,CARL,up_carl,Carl,"Wait up, you overgrown chicken!",5,spoken,,,5314,,indented,M,,True,True,True,Carl
up,561,up_s118,up_s118_u0561,0.6536,RUSSELL,RUSSELL,up_russell,Russell,"That's it, go Kevin! Go find your babies!",8,spoken,,,5319,,indented,M,,True,False,True,Russell
up,562,up_s118,up_s118_u0562,0.6536,RUSSELL,RUSSELL,up_russell,Russell,Run Kevin! Run!,3,spoken,,,5329,,indented,M,,True,False,True,Russell
up,563,up_s118,up_s118_u0563,0.6536,RUSSELL,RUSSELL,up_russell,Russell,Oh no!,2,spoken,,,5335,,indented,M,,True,False,True,Russell
up,564,up_s118,up_s118_u0564,0.6536,CARL,CARL,up_carl,Carl,"Russell, give me your knife!",5,spoken,,,5341,,indented,M,,True,True,True,Carl
up,565,up_s118,up_s118_u0565,0.6536,MUNTZ,MUNTZ (O.S.),up_muntz,Muntz,Get away from my bird!,5,spoken,,,5347,,indented,M,,True,False,True,Muntz
up,566,up_s120,up_s120_u0566,0.6648,CARL,CARL,up_carl,Carl,No!,1,spoken,,,5367,,indented,M,,True,True,True,Carl
up,567,up_s120,up_s120_u0567,0.6648,RUSSELL,RUSSELL,up_russell,Russell,No!,1,spoken,,,5377,,indented,M,,True,False,True,Russell
up,568,up_s120,up_s120_u0568,0.6648,MUNTZ,MUNTZ,up_muntz,Muntz,Careful. We want her in good shape for my return.,10,spoken,,,5390,,indented,M,,True,False,True,Muntz
up,569,up_s120,up_s120_u0569,0.6648,RUSSELL,RUSSELL,up_russell,Russell,Let her go! Stop!,4,spoken,,,5396,,indented,M,,True,False,True,Russell
up,570,up_s120,up_s120_u0570,0.6648,RUSSELL,RUSSELL,up_russell,Russell,Kevin!,1,spoken,,,5404,,indented,M,,True,False,True,Russell
up,571,up_s120,up_s120_u0571,0.6648,RUSSELL,RUSSELL,up_russell,Russell,You gave away Kevin. You just gave her away.,9,spoken,,,5414,,indented,M,,True,False,True,Russell
up,572,up_s120,up_s120_u0572,0.6648,CARL,CARL,up_carl,Carl,This is none of my concern. I didn't ask for any of this!,13,spoken,,,5420,,indented,M,,True,True,True,Carl
up,573,up_s120,up_s120_u0573,0.6648,DUG,DUG,up_dug,Dug,Master. It's alright.,3,spoken,,,5426,,indented,M,,True,False,True,Dug
up,574,up_s120,up_s120_u0574,0.6648,CARL,CARL,up_carl,Carl,"I am not your master! And if you hadn't a shown up, none of this would have happened! Bad dog! Bad dog!",22,spoken,,,5430,,indented,M,,True,True,True,Carl
up,575,up_s120,up_s120_u0575,0.6648,CARL,CARL,up_carl,Carl,"Now, whether you assist me or not, I am going to Paradise Falls if it kills me.",17,spoken,,,5444,,indented,M,,True,True,True,Carl
up,576,up_s123,up_s123_u0576,0.6816,RUSSELL,RUSSELL (O.S.),up_russell,Russell,Here.,1,spoken,,,5485,,indented,M,,True,False,True,Russell
up,577,up_s123,up_s123_u0577,0.6816,RUSSELL,RUSSELL,up_russell,Russell,I don't want this anymore.,5,spoken,,,5491,,indented,M,,True,False,True,Russell
up,578,up_s126,up_s126_u0578,0.6983,CARL,CARL,up_carl,Carl,Russell?,1,spoken,,,5578,,indented,M,,True,True,True,Carl
up,579,up_s126,up_s126_u0579,0.6983,CARL,CARL,up_carl,Carl,Russell!,1,spoken,,,5589,,indented,M,,True,True,True,Carl
up,580,up_s126,up_s126_u0580,0.6983,RUSSELL,RUSSELL,up_russell,Russell,I'm gonna help Kevin even if you won't!,8,spoken,,,5593,,indented,M,,True,False,True,Russell
up,581,up_s126,up_s126_u0581,0.6983,CARL,CARL,up_carl,Carl,"No, Russell! No!",3,spoken,,,5603,,indented,M,,True,True,True,Carl
up,582,up_s126,up_s126_u0582,0.6983,CARL,CARL,up_carl,Carl,Wahhoo!,1,spoken,,,5631,,indented,M,,True,True,True,Carl
up,583,up_s128,up_s128_u0583,0.7095,CARL,CARL,up_carl,Carl,Russell?,1,spoken,,,5652,,indented,M,,True,True,True,Carl
up,584,up_s129,up_s129_u0584,0.7151,CARL,CARL,up_carl,Carl,Dug!,1,spoken,,,5660,,indented,M,,True,True,True,Carl
up,585,up_s129,up_s129_u0585,0.7151,DUG,DUG,up_dug,Dug,I was hiding under your porch because I love you. Can I stay?,13,spoken,,,5664,,indented,M,,True,False,True,Dug
up,586,up_s129,up_s129_u0586,0.7151,CARL,CARL,up_carl,Carl,"Can you stay? Well, you're my dog aren't you? And I'm your master!",13,spoken,,,5670,,indented,M,,True,True,True,Carl
up,587,up_s129,up_s129_u0587,0.7151,DUG,DUG,up_dug,Dug,You are my master?!,4,spoken,,,5676,,indented,M,,True,False,True,Dug
up,588,up_s129,up_s129_u0588,0.7151,DUG,DUG,up_dug,Dug,Oh boy. Oh boy!,4,spoken,,,5682,,indented,M,,True,False,True,Dug
up,589,up_s130,up_s130_u0589,0.7207,CARL,CARL (O.S.),up_carl,Carl,"Good boy, Dug. You're a good boy!",7,spoken,,,5690,,indented,M,,True,True,True,Carl
up,590,up_s133,up_s133_u0590,0.7374,RUSSELL,RUSSELL,up_russell,Russell,Ooph!,1,spoken,,,5711,,indented,M,,True,False,True,Russell
up,591,up_s134,up_s134_u0591,0.743,RUSSELL,RUSSELL,up_russell,Russell,Yes! Don't worry Kevin! I'll save -,7,spoken,,,5723,,indented,M,,True,False,True,Russell
up,592,up_s135,up_s135_u0592,0.7486,MUNTZ,MUNTZ,up_muntz,Muntz,And they wouldn't believe me. Just wait till they get a look at you.,14,spoken,,,5737,,indented,M,,True,False,True,Muntz
up,593,up_s135,up_s135_u0593,0.7486,ALPHA,ALPHA,up_alpha,Alpha,Master! The small mailman has returned.,6,spoken,,,5745,,indented,M,,True,False,True,Alpha
up,594,up_s135,up_s135_u0594,0.7486,MUNTZ,MUNTZ,up_muntz,Muntz,What?,1,spoken,,,5751,,indented,M,,True,False,True,Muntz
up,595,up_s136,up_s136_u0595,0.7542,RUSSELL,RUSSELL,up_russell,Russell,Let me go!,3,spoken,,,5759,,indented,M,,True,False,True,Russell
up,596,up_s136,up_s136_u0596,0.7542,MUNTZ,MUNTZ,up_muntz,Muntz,Where's your elderly friend?,4,spoken,,,5765,,indented,M,,True,False,True,Muntz
up,597,up_s136,up_s136_u0597,0.7542,RUSSELL,RUSSELL,up_russell,Russell,He's not my friend anymore.,5,spoken,,,5771,,indented,M,,True,False,True,Russell
up,598,up_s136,up_s136_u0598,0.7542,MUNTZ,MUNTZ,up_muntz,Muntz,"Well, if you're here, Fredricksen can't be far behind.",9,spoken,,,5778,,indented,M,,True,False,True,Muntz
up,599,up_s137,up_s137_u0599,0.7598,RUSSELL,RUSSELL,up_russell,Russell,Where are you keeping Kevin!?,5,spoken,,,5788,,indented,M,,True,False,True,Russell
up,600,up_s138,up_s138_u0600,0.7654,RUSSELL,RUSSELL,up_russell,Russell,Let me go!,3,spoken,,,5796,,indented,M,,True,False,True,Russell
up,601,up_s138,up_s138_u0601,0.7654,BETA,BETA,up_beta,Beta,"Scream all you want, small mailman.",6,spoken,,,5800,,indented,M,,True,False,True,Beta
up,602,up_s138,up_s138_u0602,0.7654,GAMMA,GAMMA,up_gamma,Gamma,None of your mailman friends can hear you.,8,spoken,,,5804,,indented,M,,True,False,True,Gamma
up,603,up_s138,up_s138_u0603,0.7654,RUSSELL,RUSSELL,up_russell,Russell,I'll unleash all my Wilderness Explorer training!,7,spoken,,,5810,,indented,M,,True,False,True,Russell
up,604,up_s138,up_s138_u0604,0.7654,MUNTZ,MUNTZ,up_muntz,Muntz,"Alpha! Fredricksen's coming back. Guard that bird. If you see the old man, you know what to do.",18,spoken,,,5820,,indented,M,,True,False,True,Muntz
up,605,up_s138,up_s138_u0605,0.7654,RUSSELL,RUSSELL,up_russell,Russell,"Hey, where are you going? I'm not finished with you!",10,spoken,,,5830,,indented,M,,True,False,True,Russell
up,606,up_s138,up_s138_u0606,0.7654,MUNTZ,MUNTZ,up_muntz,Muntz,Nice talking with you.,4,spoken,,,5836,,indented,M,,True,False,True,Muntz
up,607,up_s139,up_s139_u0607,0.7709,MUNTZ,MUNTZ,up_muntz,Muntz,"Where are you, Fredricksen?",4,spoken,,,5851,,indented,M,,True,False,True,Muntz
up,608,up_s141,up_s141_u0608,0.7821,CARL,CARL,up_carl,Carl,Russell!,1,spoken,,,5873,,indented,M,,True,True,True,Carl
up,609,up_s142,up_s142_u0609,0.7877,RUSSELL,RUSSELL,up_russell,Russell,Mr. Fredricksen!,2,spoken,,,5889,,indented,M,,True,False,True,Russell
up,610,up_s142,up_s142_u0610,0.7877,CARL,CARL,up_carl,Carl,Dug! Bring `er over!,4,spoken,,,5893,,indented,M,,True,True,True,Carl
up,611,up_s143,up_s143_u0611,0.7933,RUSSELL,RUSSELL,up_russell,Russell,You came back for Kevin! Let's go get her.,9,spoken,,,5908,,indented,M,,True,False,True,Russell
up,612,up_s143,up_s143_u0612,0.7933,CARL,CARL,up_carl,Carl,I'm getting Kevin. You stay here!,6,spoken,,,5914,,indented,M,,True,True,True,Carl
up,613,up_s143,up_s143_u0613,0.7933,RUSSELL,RUSSELL,up_russell,Russell,But I want to help!,5,spoken,,,5918,,indented,M,,True,False,True,Russell
up,614,up_s143,up_s143_u0614,0.7933,CARL,CARL,up_carl,Carl,I don't want your help. I want you safe!,9,spoken,,,5922,,indented,M,,True,True,True,Carl
up,615,up_s144,up_s144_u0615,0.7989,CARL,CARL,up_carl,Carl,How do we get past these dogs?,7,spoken,,,5936,,indented,M,,True,True,True,Carl
up,616,up_s144,up_s144_u0616,0.7989,DUG,DUG,up_dug,Dug,Uh... POINT!,2,spoken,,,5940,,indented,M,,True,False,True,Dug
up,617,up_s146,up_s146_u0617,0.8101,CARL,CARL,up_carl,Carl,Kevin!,1,spoken,,,5958,,indented,M,,True,True,True,Carl
up,618,up_s146,up_s146_u0618,0.8101,CARL,CARL,up_carl,Carl,"Don't worry Kevin, we're on our way!",7,spoken,,,5964,,indented,M,,True,True,True,Carl
up,619,up_s146,up_s146_u0619,0.8101,ALPHA,ALPHA,up_alpha,Alpha,"Allow no one to be entering through these doors. Guard well that bird, my minions.",15,spoken,,,5975,,indented,M,,True,False,True,Alpha
up,620,up_s146,up_s146_u0620,0.8101,CARL,CARL,up_carl,Carl,"What do we do now, Dug?",6,spoken,,,5983,(WHISPERS),indented,M,,True,True,True,Carl
up,621,up_s147,up_s147_u0621,0.8156,CARL,CARL,up_carl,Carl,Who wants the ball?,4,spoken,,,6001,,indented,M,,True,True,True,Carl
up,622,up_s147,up_s147_u0622,0.8156,DOGS,DOGS,up_dogs,Dogs,Me! I do! I want the ball!,7,spoken,,,6005,,indented,Both,,False,False,False,Dogs
up,623,up_s147,up_s147_u0623,0.8156,CARL,CARL,up_carl,Carl,Then go get it!,4,spoken,,,6009,,indented,M,,True,True,True,Carl
up,624,up_s148,up_s148_u0624,0.8212,DOGS,DOGS,up_dogs,Dogs,I'm gonna get there first! Oh gonna get the ball! I'm gonna get it!,14,spoken,,,6019,,indented,Both,,False,False,False,Dogs
